{
  "chapter": 21,
  "chapter_title": "A Warning Rejected",
  "stage": "adversarial",
  "generated_at": "2026-07-05",
  "notes": "searches: 0; full defenses: 0, cheap audits: 0. Pass-through: verification produced 0 contradicted, 0 misquotation, 0 anachronistic. The only non-supported empirical verdict is GC-21-082 (disputed, Rome-withheld-the-Bible framing vs. Deanesly's nuance); per pipeline policy the disputed verdict is already cautious and skips the defense stage. No claims fell within defender scope, so all 90 claims are carried forward unchanged with no defense objects added.",
  "claims": [
    {
      "id": "GC-21-001",
      "paragraph": 1,
      "quote": "In preaching the doctrine of the second advent, William Miller and his associates had labored with the sole purpose of arousing men to a preparation for the judgment.",
      "claim_text": "William Miller and his fellow Millerite preachers preached the doctrine of Christ's imminent second advent with the sole stated purpose of arousing people to prepare for the judgment.",
      "claim_type": "event",
      "entities": ["William Miller"],
      "needs_verification": true,
      "verification": {
        "verdict": "supported",
        "confidence": "medium",
        "rationale": "source_quality: academic-partial. Miller's own writings (Apology and Defence, in Bliss's Memoirs) and modern Millerite scholarship confirm the movement's self-understood evangelistic/preparation purpose. Taylor notes Miller's stated aim was to warn of the judgment, not to found a sect.",
        "modern_consensus": "Miller framed his preaching as a call to prepare for the judgment within existing churches.",
        "sources": [
          {"title": "A. Taylor, The Origins of Millerite Separatism (thesis)", "url": "https://digitalcommons.uri.edu/theses/2297/", "source_class": "academic", "supports_verdict": true},
          {"title": "Memoirs of William Miller (Bliss, 1853)", "url": "https://m.egwwritings.org/en/book/1009.2212", "source_class": "primary", "supports_verdict": true}
        ]
      }
    },
    {
      "id": "GC-21-002",
      "paragraph": 1,
      "quote": "They had sought to awaken professors of religion to the true hope of the church, and to their need of a deeper Christian experience; and they labored also to awaken the unconverted to the duty of immediate repentance and conversion to God.",
      "claim_text": "Miller and his associates sought to awaken religious professors to a deeper Christian experience and to awaken the unconverted to the duty of immediate repentance and conversion to God.",
      "claim_type": "event",
      "entities": ["William Miller"],
      "needs_verification": true,
      "verification": {
        "verdict": "supported",
        "confidence": "medium",
        "rationale": "source_quality: academic-partial. Consistent with Miller's revivalist aims documented in his own defence and in Millerite historiography; the movement operated as a revival/awakening effort within the churches.",
        "modern_consensus": "The Millerite preaching functioned as an interdenominational revival emphasizing repentance and readiness.",
        "sources": [
          {"title": "A. Taylor, The Origins of Millerite Separatism (thesis)", "url": "https://digitalcommons.uri.edu/theses/2297/", "source_class": "academic", "supports_verdict": true}
        ]
      }
    },
    {
      "id": "GC-21-003",
      "paragraph": 1,
      "quote": "“They made no attempt to convert men to a sect or party in religion. Hence they labored among all parties and sects, without interfering with their organization or discipline.”(618)",
      "claim_text": "A source cited in footnote 618 states that the Millerites made no attempt to convert people to a separate sect or party in religion, and labored among all parties and sects without interfering with their organization or discipline.",
      "claim_type": "attributed_quote",
      "entities": ["William Miller", "Millerites"],
      "needs_verification": true,
      "verification": {
        "verdict": "supported",
        "confidence": "medium",
        "rationale": "source_quality: academic-partial. The quotation reflects the well-documented early anti-sectarian, non-separatist stance of the Millerite movement; Taylor confirms the movement's official position discouraged separation until 1843-44.",
        "modern_consensus": "The early Millerite movement explicitly disavowed forming a new sect and worked across denominations.",
        "sources": [
          {"title": "A. Taylor, The Origins of Millerite Separatism (thesis)", "url": "https://digitalcommons.uri.edu/theses/2297/", "source_class": "academic", "supports_verdict": true}
        ]
      }
    },
    {
      "id": "GC-21-004",
      "paragraph": 2,
      "quote": "“In all my labors,” said Miller, “I never had the desire or thought to establish any separate interest from that of existing denominations, or to benefit one at the expense of another. I thought to benefit all.",
      "claim_text": "William Miller stated that in all his labors he never desired or intended to establish a separate religious interest apart from existing denominations, and sought to benefit all of them.",
      "claim_type": "attributed_quote",
      "entities": ["William Miller"],
      "needs_verification": true,
      "verification": {
        "verdict": "supported",
        "confidence": "high",
        "rationale": "source_quality: academic-partial. The quotation is located verbatim in Miller's 'Apology and Defence' as reproduced in Bliss's Memoirs of William Miller; wording matches.",
        "modern_consensus": "Authentic Miller statement of non-sectarian intent.",
        "sources": [
          {"title": "Memoirs of William Miller (Bliss, 1853), Apology and Defence", "url": "https://m.egwwritings.org/en/book/1009.2212", "source_class": "primary", "supports_verdict": true}
        ]
      }
    },
    {
      "id": "GC-21-005",
      "paragraph": 2,
      "quote": "My whole object was a desire to convert souls to God, to notify the world of a coming judgment, and to induce my fellow-men to make that preparation of heart which will enable them to meet their God in peace.",
      "claim_text": "William Miller stated that his whole object was to convert souls to God, notify the world of a coming judgment, and induce people to prepare their hearts to meet God in peace.",
      "claim_type": "attributed_quote",
      "entities": ["William Miller"],
      "needs_verification": true,
      "verification": {
        "verdict": "supported",
        "confidence": "high",
        "rationale": "source_quality: academic-partial. Continuation of the same authentic passage from Miller's Apology and Defence (Bliss, Memoirs); wording matches.",
        "sources": [
          {"title": "Memoirs of William Miller (Bliss, 1853)", "url": "https://m.egwwritings.org/en/book/1009.2212", "source_class": "primary", "supports_verdict": true}
        ]
      }
    },
    {
      "id": "GC-21-006",
      "paragraph": 2,
      "quote": "The great majority of those who were converted under my labors united with the various existing churches.”(619)",
      "claim_text": "William Miller stated that the great majority of those converted under his preaching united with existing churches rather than forming a separate denomination.",
      "claim_type": "attributed_quote",
      "entities": ["William Miller"],
      "needs_verification": true,
      "verification": {
        "verdict": "supported",
        "confidence": "high",
        "rationale": "source_quality: academic-partial. Same authentic Miller passage (footnote 619 = Bliss, Memoirs). Consistent with the pre-1844 non-separatist phase documented by Taylor.",
        "sources": [
          {"title": "Memoirs of William Miller (Bliss, 1853)", "url": "https://m.egwwritings.org/en/book/1009.2212", "source_class": "primary", "supports_verdict": true},
          {"title": "A. Taylor, The Origins of Millerite Separatism (thesis)", "url": "https://digitalcommons.uri.edu/theses/2297/", "source_class": "academic", "supports_verdict": true}
        ]
      }
    },
    {
      "id": "GC-21-007",
      "paragraph": 3,
      "quote": "As his work tended to build up the churches, it was for a time regarded with favor.",
      "claim_text": "Miller's preaching was for a time regarded with favor by churches because it tended to build up their membership.",
      "claim_type": "causal",
      "entities": ["William Miller"],
      "needs_verification": true,
      "verification": {
        "verdict": "supported",
        "confidence": "medium",
        "rationale": "source_quality: academic-partial. Millerite historiography records early clerical welcome of Miller as a revivalist before opposition hardened; Taylor traces the shift from acceptance to rejection culminating in 1843-44.",
        "sources": [
          {"title": "A. Taylor, The Origins of Millerite Separatism (thesis)", "url": "https://digitalcommons.uri.edu/theses/2297/", "source_class": "academic", "supports_verdict": true}
        ]
      }
    },
    {
      "id": "GC-21-008",
      "paragraph": 3,
      "quote": "But as ministers and religious leaders decided against the advent doctrine, and desired to suppress all agitation of the subject, they not only opposed it from the pulpit, but denied their members the privilege of attending preaching upon the second advent, or even of speaking of their hope in the social meetings of the church.",
      "claim_text": "Ministers and religious leaders who decided against the second-advent doctrine opposed it from the pulpit and denied their members the privilege of attending advent preaching or discussing their hope in church social meetings.",
      "claim_type": "event",
      "entities": [],
      "needs_verification": true,
      "verification": {
        "verdict": "supported",
        "confidence": "medium",